,sentence,author,title,pet
132,"in the past, the claim of ''states' rights'' has meant neglect of the special needs and rights of minorities",bmd,new-federalismold-discriminationism,special needs
133,"the recent demise of cbs cable suggests, too, that the marketplace may not be able to provide high culture, as public broadcasting has in the past",bmfadb,broadcasters-burdens,demise
134,"our findings suggest that the elderly have not become poorer as a result of the last decade's high inflation, as is widely believed, but have actually become richer relative to the rest of the population, at least in terms of income",bmh,old-doesnt-mean-poor,elderly
135,"accordingly, congress should distinguish between ''elderly poor'' and ''elderly rich'' in the allocation of benefits",bmh,old-doesnt-mean-poor,elderly
136,it is widely and erroneously believed that the elderly lose more to inflation than the young and middle-aged because the products they consume rise in price faster and because they live on fixed incomes,bmh,old-doesnt-mean-poor,elderly
137,"the elderly, aged 65 and above, do indeed consume different goods than those used to calculate the consumer price index",bmh,old-doesnt-mean-poor,elderly
138,"if the prices of the goods they consume the most were to rise faster than the prices of other goods, the elderly would suffer from having their social security benefits tied to this index",bmh,old-doesnt-mean-poor,elderly
139,but prices for the elderly have actually differed very little from those for the nonelderly,bmh,old-doesnt-mean-poor,elderly
140,"the supposedly ''fixed'' incomes of the elderly have in reality risen faster than the rate of inflation, and even somewhat faster than the incomes of the younger population",bmh,old-doesnt-mean-poor,elderly
141,"real income per elderly household rose 18 percent between 1970 and 1978, a period of particularly high inflation",bmh,old-doesnt-mean-poor,elderly
142,but the disparity between rich and poor among the elderly was narrowing during this period,bmh,old-doesnt-mean-poor,elderly
143,from 1970 to 1978 the fraction of elderly families below the government poverty level fell from 24,bmh,old-doesnt-mean-poor,elderly
144,there still remains a substantial fraction of the elderly below the poverty level - more than among the nonelderly - but the gains are substantial,bmh,old-doesnt-mean-poor,elderly
145,these income figures are particularly remarkable when one considers that the fraction of the elderly male population working declined from 25,bmh,old-doesnt-mean-poor,elderly
146,"to be sure, during a few years of inflation, incomes might have held up well even as the wealth of the elderly eroded",bmh,old-doesnt-mean-poor,elderly
147,"but the elderly do not, as is widely believed, hold the majority of their wealth in savings accounts and other assets that are particularly vulnerable to inflation",bmh,old-doesnt-mean-poor,elderly
148,the most important wealth holdings of most elderly are houses and the value of expected future social security benefits,bmh,old-doesnt-mean-poor,elderly
149,a jump in prices of a dollar will cause only a 10-cent loss in real wealth for the elderly,bmh,old-doesnt-mean-poor,elderly
150,"the poor elderly have few such holdings, and their wealth is on average completely unaffected by price changes",bmh,old-doesnt-mean-poor,elderly
151,"rather than seek to protect the incomes and wealth of the elderly, we should seek to help the poor elderly without giving unneeded windfalls to the wealthly elderly",bmh,old-doesnt-mean-poor,elderly
152,"for example, the benefits of the well-to-do elderly could be reduced by subjecting them to the income tax",bmh,old-doesnt-mean-poor,elderly
153,it is quite fair to suggest that these recipients should have their benefits reduced in order to maintain (or increase) those of the poor elderly,bmh,old-doesnt-mean-poor,elderly
154,''elderly'' and ''needy'' are really very different things,bmh,old-doesnt-mean-poor,elderly
155,"while the american and world economies are undergoing structural transformations more profound than any since the late 19th century, established wisdom has responded with a 167-year-old idyll called free trade",bmh,worker-be-saved,late
156,"until 1963, a state could convict an indigent defendant of a felony and send him to prison even though he had not been defended by a lawyer at trial",bmhf,gideon-ii,indigent
157,"a dozen years later, however, legal observers noted a growing gap between the constitutional right to counsel and what one newspaper called ''the real-life availability of free, court-appointed lawyers for indigent defendants",bmhf,gideon-ii,indigent
158,"before that case, indigent defendants were tried, convicted and imprisoned without having lawyers to represent them",bmhf,gideon-ii,indigent
159,"before he came to power, the soviet union had never experienced more than two consecutive bad harvests; it is now suffering through a record fourth bad harvest",bmig,a-legacy-of-deficits,experienced
160,khrushchev experienced problems under mr,bmig,a-legacy-of-deficits,experienced
161,"on the other side of town is another stream, a rather larger one, in the fork of which sits on old estate managed by my aunt and an elderly cousin",bmj,the-voices-of-the-turtles-are-heardat-home,elderly
162,"last memorial day weekend, one especially big old turtle, her biological clock perhaps thrown off by senility, came out rather late, after the crows were awake",bmj,the-voices-of-the-turtles-are-heardat-home,late
163,"the crows were about to dig up the nest and eat the eggs when my elderly cousin, who arises even before the crows, chased off the birds, dug up the nest and left it in the bucket that now sits midway between the radiator and my stereo components",bmj,the-voices-of-the-turtles-are-heardat-home,elderly
164,i walked away from the scene of the crime as one walks away from a gory auto accident,bmm,mugged-sort-of,accident
165,"why not go all the way with the notion that the only story is the numbers; if the bottom line is reduced to zero, how and who brought it there should make no difference - except as a case study for future m",bmmt,peanuts,go all the way
166,"the ''constitutional'' role of the military was determined by the first prime minister, david ben-gurion, in the late 1940's",bmp,TOO-MUCH-U.S.-'ROPE',late
167,the american-soviet talks on mutually balanced reductions of forces in europe started late and are yielding little,bneatr,a-crisis-in-nato-on-missiles,late
168,schmidt has placed his own neck in a political guillotine: the odds that his coalition can survive the euromissile vote he must call are slim,bneatr,a-crisis-in-nato-on-missiles,slim
169,"its fondest international hopes are for a neutralized west germany and a disgruntled, isolated america",bneatr,a-crisis-in-nato-on-missiles,neutralized
170,"'' i released my grip, expecting that when she turned to face me, there would be a moment of revelation",bof,when-i-shaved-off-my-mustache,expecting
171,turkeys clung to branches just high enough to allow them to peer at the hideous carcass of their late friend,bpe,when-forks-clashed,late
172,"once you've mastered it, metric measurement is demonstrably more economical and simpler to use than the english system",bpr,yes-virginia-new-yorkers-once-dialed-exchanges,economical
173,"we must not allow ourselves to be deprived of our little extravagances, our harmless fits of subdued abandon",bpr,yes-virginia-new-yorkers-once-dialed-exchanges,deprived
174,"it would be a tragedy to repeat the blunders of 1930: if the federal reserve late in that year had taken determined and non-radical action, the post-1929 stock market crash could have been contained as a normal capitalistic recession instead of snowballing into a failure of thousands of banks and into a great depression",bps,apolitical-science-supports-the-fed,late
175,"at the request of his lawyer, the hearing examiner dismissed a complaint that what happens when you complain",brc,the-editorial-notebook-taxi,dismissed
176,petersburg masstransit programs to pay the heating bills of the elderly in st,brdl,the-economic-pie-isn-t-growing-but-more-americans-need-slices,elderly
177,"decisions on the elderly, on immigration, on the handicapped, on health care, which were once so easy, will become immensely harder",brdl,the-economic-pie-isn-t-growing-but-more-americans-need-slices,elderly
178,"within the ranks of the elderly, the rise of ''old-old,'' those 75 and over, is nearly twice that of the ''young-old'' (65-74)",brdl,the-economic-pie-isn-t-growing-but-more-americans-need-slices,elderly
179,"in fiscal 1981, the elderly got one dollar of every four in the federal government's budget - up 30 percent from 1979, and growing",brdl,the-economic-pie-isn-t-growing-but-more-americans-need-slices,elderly
180,"ann kutza of the university of chicago suggests in ''the benefits of old age'' that as the number of elderly increases, as financial pressures and tax burdens on young families grow and as costs soar it's time to ask ''not have we done enough for the elderly but have we done too much",brdl,the-economic-pie-isn-t-growing-but-more-americans-need-slices,elderly
181,"that statement is as applicable to the continuing lack of a policy toward the soviet union that is both coherent and worked out with our western european partners as it is to passivity in the face of israel's concerns that led it to invade lebanon, the switching of signals sent to the argentine junta last year, and the carter administration's late awakening to perils faced by the shah of iran",breh,MISUSING-ECONOMIC-SANCTIONS,late
182,"troubled by inflation and budget deficits, group members, notably mr",brl,atari-democrats,troubled
183,"the requirement that companies wanting to do business in a developing country must agree, as a condition for entry, to export a certain dollar amount or percentage of the company's production in order to earn foreign exchange, can effectively keep a company out",brrm,end-nontariff-barriers,developing country
184,"as a result of our decision, numerous jobs and high-technology manufacturing were lost to the developing country",brrm,end-nontariff-barriers,developing country
185,"by 1980, key indicators of mechanical condition hit all-time lows, and passengers experienced the worst service in memory",brsasmj,more-sub-than-way,experienced
186,"the white house has also chosen to ignore the dictator's repression of suspected marxists - although an estimated 30,000 leftist and liberal chileans have perished in concentration camps or been killed by firing squads since general pinochet came to power in 1973",bsc,dont-certify-chile,perished
187,"in late summer, general fernando paredes of the chilean secret police charged that church leaders have been recruited by soviet agents and have become ''allies of the marxists",bsc,dont-certify-chile,late
188,but it would be a mistake for us to confirm a suspicion prominent in some minds that the fear of both israel's army reoccupying the sinai and america's withdrawal of its multimillion dollar aid package has neutralized us and left a clear field for begin and his military cohorts to wreak havoc in the region,bsh,egyptians-ask-why-cambridge-mass-it-is-perhaps-somewhat-unseemly-to,neutralized
189,but ariel sharon is israeli-born and was reared in the bosom of the labor movement at a time when it was still committed to the values of humanism and socialist internationalism,bsh,egyptians-ask-why-cambridge-mass-it-is-perhaps-somewhat-unseemly-to,bosom
190,"these are not grounds for reneging on our commitment to israel's existence, but if, like other egyptians, i feel deep pessimism it is because we are troubled by this thought: if it was possible for the sons of those who suffered from hitler's persecution to map out a plan for the ''pacification of the galilee'' that led to the shatila and sabra massacre, what is to assure us that in a generation or two there will not arise another military leader with a psyche like mr",bsh,egyptians-ask-why-cambridge-mass-it-is-perhaps-somewhat-unseemly-to,troubled
191,1 million (leaving out perhaps hundreds of thousands of illegal immigrants),bshs,new-york-75-cents-is-enough,illegal immigrants
192,"hayes filed his first lawsuit), the city was providing beds for only 1,800 of the homeless and spending $8 million a year doing it",bshs,new-york-busing-the-homeless,doing it
193,"5 million, but that didn't include the half-free illegal immigrants, so rounding it out is certainly no worse than rounding out an opponent's record",bshs,new-york-free-the-18-million,illegal immigrants
194,people used to switch their channel knobs on their television sets to change programs; now they're doing it during the commercials,bshs,new-york-free-the-18-million,doing it
195,"one was that, no matter how experienced we new york cityites have become at adjusting to shrunken services and tax pain, these new cuts in basic services are going to be visible in many instances and they are going to hurt",bshs,new-york-it-s-time-to-share-the-pain,experienced
196,"the court of appeals yesterday said the opposite - that unless it could be shown that the winner was responsible for the fraud, he could not be deprived of his victory, ''nor does the record in this case warrant the imposition of such a sanction",bshs,new-york-mississippi-for-a-while,deprived
197,"they voted instead for the man who was opposed for the most part by the democratic party organization, whose campaign chest was less than half the size of his opponent's, who stuck by his unpopular stance against the death penalty, who ran against reaganism at a time when the conventional wisdom suggests this is a path reserved only for dreamers or fools, and who sought to revive the old democratic coalition of liberals, labor and minorities that the so-called party pragmatists had long since declared extinct",bshs,new-york-mythology-takes-a-beating,chest
198,"'' i suppose some of the genetic theorists might argue that only hereditarily superior blacks manage to make it into the economic middle class and therefore, as they pass on their genes, their children in turn are scoring higher these days on the s",bshs,new-york-new-patterns,pass on
199,"koch knew how troubled the city's financial future was, and some of his closest advisers had used that as an argument to persuade him to put the no-win mess behind him and run for governor",bshs,new-york-our-new-fiscal-crisis,troubled
200,they'd just spend it on more cops and sanitation workers and subway repairmen,bshs,new-york-striclty-beau-monde,sanitation workers
201,don't drag your feet any longer - write to the mayor immediately and tell him to lay off donald trump,bshs,new-york-striclty-beau-monde,lay off
202,"a friend visiting from london a while back, talking about how unfettered the fare on television had become, mentioned that a few days before he had been watching a sex-change operation on british television and had now been introduced to late-night explicit sex frolics on new york's cable channels",bshs,new-york-styx-at-six,late
203,which means that we will probably need more money than any other city or state to repair our aging public works and restore these vital arteries at least to safe condition,bshs,new-york-tank-traps-ahead,aging
204,i found them worth passing on,bshs,new-york-testimony-about-the-system,passing on
205,i'm saying these things because i've personally experienced them,bshs,new-york-testimony-about-the-system,experienced
206,"back in 1979, the department of housing preservation and development told the low-income and working-class tenants who had agreed to apply their own sweat and labor and expenses to keep alive their city-owned buildings (which had been abandoned by tax-defaulting landlords) that it would eventually sell these tenants their apartments for $250",bshs,new-york-the-250-promise,low-income
207,and such ''gentrification'' - to be accomplished by putting the buildings on the open-market auction block for purchase and renovation - would simply price out of these neighborhoods the low-income residents who had put life back into the tenements,bshs,new-york-the-250-promise,low-income
208,"the mayor -through deputy mayor nathan leventhal - said he would not negotiate further and threatened that if they didn't agree to his plan, he would not sell any of these apartments to the people who had reclaimed them from vermin and drug addicts",bshs,new-york-the-250-promise,addicts
209,"the nub of this counter-plan is a set of formulas and city auditing procedures that would insure that if tenants wanted to keep their building as housing for low-income people, the resale prices would be held in that income range, and no tenant would make a profit from selling his apartment",bshs,new-york-the-250-promise,low-income
210,"it's hard to tell, but all the administration's rhetoric works to conceal its failures in low-income housing",bshs,new-york-the-250-promise,low-income
211,such questions as: doesn't the city want low-income people in these neighborhoods,bshs,new-york-the-250-promise,low-income
212,"also, the traditional state and local method of paying for public works -selling government bonds - has been badly hobbled of late by high interest rates that have made the cost of issuing such bonds often prohibitive",bshs,new-york-the-sky-is-loosening,late
213,"as every study keeps pointing out, the cost of rebuilding our crumbling public facilities is nowhere near as great as the cost of not doing it",bshs,new-york-the-sky-is-loosening,doing it
214,"and since no one is building low-income housing these days, where are these people to go",bshs,new-york,low-income
215,and so forth - until it becomes absolutely clear that the koch program is not a housing policy and has almost nothing to do with providing shelter for low-income people,bshs,new-york,low-income
216,why is it that low-income people who have bathtubs in their kitchens and toilets down the hall and who have kept their buildings alive with sweat and money are the only ones ever asked to share their ''profits'' with the city,bshs,new-york,low-income
217,"isn't the city willing to forgo this money - if, indeed, there is any net gain - and call it an investment in low-income housing",bshs,new-york,low-income
218,"with the american hospital association cheering on the sidelines, the administration wants to weaken or destroy many federal regulations affecting 1,500 hospitals, thereby threatening the health and safety of millions of patients - especially the elderly and the poor",bsmw,reagans-hospital-proposals-would-hurt-the-poor-and-old,elderly
219,'' neither the elderly nor the poor nor any other patients or patients' groups are listed as ''interested parties'' that are expected to comment,bsmw,reagans-hospital-proposals-would-hurt-the-poor-and-old,elderly
220,"local sources of livelihood are few and far between, and a substantial part of the local manpower is employed in israel, jordan and in the wealthy arab countries",bss,jordan-as-the-palestinian-state,wealthy
221,"did the government get in the way of self-reliance or did it, rather, put an end to a quick fix",bss,new-york-the-rest-of-the-story,did it
222,"practically all of the unemployed were able-bodied and capable, and they besieged him for chances at working for their keep",bss,new-york-the-rest-of-the-story,able-bodied
223,"lehrman, a wealthy businessman who helped build his family's rite-aid chain of drugstores and whose conservative lehrman institute played a role in making supply-side theory a household word",bsss,new-york-discarding-campaign-trash,wealthy
224,"abdullah was disappointed that the british had not chosen him as king iraq, and was threatening to march on damascus, expel the french and seize the crown of syria, of which the french had deprived his brother faisal",bsz,is-jordan-palestine-of-course,deprived
225,"'' he said: ''even if it were my last act as president, i'd be happy i did it because that journey made a difference and changed the world",btbf,historys-sadat,did it
226,"several states, particularly wealthy energy producers, would receive far fewer dollars under the tax capacity index than under the per capita formula",btjarw,a-fruitless-swap,wealthy
227,miguel de la madrid hurtado succeeds jose lopez portillo as president at a time when mexico's financial crisis threatens to produce a social convulsion that would lead not to some egalitarian utopia but to the demise of the mexican government's commitment to a more just society,btjface,a-rightist-mexico,demise
228,a policy of beggaring the poor and suppressing resistance would create a wave of illegal immigrants - and our efforts to turn them back would strain both our politics and economic resources,btjface,a-rightist-mexico,illegal immigrants
229,"it seemed not so long ago that halloween was about to fade away, and it probably would have, had not some dimwitted do-gooder come up with the idea of having schools provide younger children with empty milk cartons, into which householders would be obliged to drop coins for the united nations children's fund, lest they be subjected to a halloween trick",btmb,treat-halloween-as-trick-because-we-fool-ourselves,fade away
230,"we protect our children at every turn, save for halloween, when we dress them up and push them out into the cold blackness of a late october night to scare the wits out of each other, to be frightened by older children, to be clobbered by debris, to risk being run down by anxious motorists hurrying home on dark, often slippery roads, to collect bags of loot which will cause bellyaches or tooth cavities or worse",btmb,treat-halloween-as-trick-because-we-fool-ourselves,late
231,"for the first time in history, it is within the power of a less-developed country to obtain from external savings the capital needed for growth",bwbw,banking-against-disaster,developed country
232,"a law was even decreed that made the public mention of my name, or that of any citizen deprived of his civil rights, punishable by six months' incarceration",bwfa,in-uruguay-a-democratic-step-maybe,deprived
233,"those who have moved on to relative prosperity must return to the inner city and volunteer to work with organizations like the urban league, the national association for the advancement of colored people, the opportunities industrial centers, operation push and others that inspire young blacks to seek a better life",bwjh,a-black-responsibility,inner city
234,ronald reagan's robin hood-in-reverse strategy of taking from the poor and giving to the rich should be reversed by rescinding the tax cuts given the wealthy - worth $36 billion to the 20 percent at the top of the income scale in 1982 alone - and giving the money saved to the 80 percent who have not benefited so far,cp,INSURE-THE-CONSUMER,wealthy
235,"meanwhile, the worldwide boom in oil drilling is turning into something of a bust",dy,pangloss-on-the-energy-future-wishful-thinking,bust
236,"it deprives the west of its most experienced, its most effective, and, in the eyes of many, its most attractive statesman",fs,for-bonn-instability,experienced
237,"the christian democratic union is an experienced, democratic party, with many outstanding leaders, even if the new chancellor, helmut kohl, is a man whose chief virtue is the absence of known vice",fs,for-bonn-instability,experienced
238,"the rather unseemly haste with which the central committee was convened to ratify this decision, even before the late ruler was buried, is most unusual, and suggests an urgent desire on someone's part to foreclose other possibilities",gfk,ANDROPOV,late
239,these seductive remedies for economic ills threaten to drag the world into another period of trade warfare such as the one which we experienced during the great depression,grf,stop-the-drift-toward-economic-anarchy,experienced
240,the restrictions were tightened in the late 1960's because congress believed that individuals (or individual trusts) should not be able to use tax-exempt money to politick,ja,think-tanks-politick,late
241,"in the late 70's, the west correctly understood that appeals to sweet reason would not persuade the kremlin to dismantle a powerful nuclear arsenal that it was expanding with breathtaking speed",jj,euromissile-myths,late
242,"most congressmen look fairly healthy and even fancy on tv, but most of them are in middle age, caught in the middle between their rebellious children and their aging parents",jr,washington-a-bonus-for-congress,aging
243,"accordingly, it might not be a national disaster if one or two of them were dismissed in each congressional office, and the boss added their salary to his own, and had to do a little more work to speak for himself",jr,washington-a-bonus-for-congress,dismissed
244,''i am deeply troubled,jr,washington-a-talk-with-schmidt,troubled
245,"''are we to be deprived of active, experienced citizens or merely depend on people who are retired or are on welfare, who need the $30 a day they are paid for jury duty",jr,washington-crisis-in-the-courts,deprived
246,"for all that we want to receive -higher wages, lower prices - let us go on strike",jr,washington-let-us-give-thanks,let us go
247,"de la madrid's tough, new program will do to increase unemployment in mexico and encourage the flow of illegal immigrants over the border and into the united states",jr,washington-mexico-back-to-reality,illegal immigrants
248,"reagan dismissed it as a crazy gamble, and now that it's up he claims it as proof that his policies were right from the beginning",jr,washington-mondale-s-tough-line,dismissed
