,sentence,author,title,pet
249,"but when america took on this responsibility to counter aggression by the soviet union and its surrogates in afghanistan, southeast asia, poland, africa or central america, he complained, it was apt to be criticized for what it did, or how it did it, or both",jr,washington-reagan-s-man-in-bonn,did it
250,isn't it a little slim,jr,washington-santa-at-the-border,slim
251,"it reminds me of a similar argument during the last world war when the late adlai stevenson, then in the navy department, was talking to a soviet diplomat about the delivery of supplies to moscow",jr,washington-the-nuclear-blackout,late
252,"the group to be tried consists of seven members of kor - an acronym for the workers defense committee, later renamed public self-defense committee - which was established in september 1976 to provide legal, medical and financial help to workers who had been beaten up, tortured and dismissed from work during the strikes that summer",lkasb,warsaws-next-step-solidarity-on-trial,dismissed
253,throw-weight is one measure of destructive power that can be launched against an adversary - another one of the soviet advantages that so troubled mr,mk,ARMS-NONPOLICY,troubled
254,"in testimony before a joint session of senate and assembly committees, the state tax commissioner, james tully, summed up why many of these taxes are yet to be collected: ''never underestimate the resourcefulness of intelligent lawyers who have wealthy clients",mpagr,turnstilejumping-by-corporations,wealthy
255,simpson-mazzoli seeks to limit the increased flow of illegal immigrants without curtailing civil liberties in the bargain,mst,peso-refugees,illegal immigrants
256,"in midafternoon my head abruptly stopped gushing away through eye slits and nostrils, and an immense but invisible chain was suddenly cinched tight around my chest",rb,OBSERVER;-ADDALS-OF-MEDICID,chest
257,"'' late that night while he slept, i browsed in his diary",rb,OBSERVER;-FEAR-OF-SPYING,late
258,is it any wonder that a nation that lives in terror of finding a dandruff flake on its shoulder should recoil from a river that has 75 percent of yesterday's sewage on its bosom,rb,OBSERVER;-Ring-Around-The-River,bosom
259,"using the same technique, you could take some of the gloss off julius caesar's reputation by pointing out that he was a sexist, what with failing to open enlistments in the roman legions to women and expecting his wife to sit home doing nothing but being as pure as caesar's wife",rb,history-is-debunk,expecting
260,"out on the street these late december mornings temperatures go down to 25, to 15 degrees",rb,observer-a-cold-hard-net,late
261,"a young whippersnapper writing in the washington monthly complains that we senior citizens, having squandered the nation's prodigious wealth in our salad days, now want to force his generation to submit to soul-crushing taxation so that we may continue our profligate ways",rb,observer-back-off-a-little-kiddies,senior citizens
262,thus the program's cost will be reduced by reducing the number of elderly recipients,rb,observer-back-off-a-little-kiddies,elderly
263,"''it's too late,'' the director of campaign gimcracks said",rb,observer-beating-around-the-bush,late
264,tomorrow will be a day of terror for the millions of americans who live with football addicts,rb,observer-sunday-bloodless-sunday,addicts
265,"deprived of their regular sunday fix by the strike of professional players, these wretched addicts will require the most delicate and sympathetic handling by their next of kin and loved ones",rb,observer-sunday-bloodless-sunday,addicts
266,"liverworth, author of ''how to live with your football junkie,'' tells me that cold-turkey withdrawal by the nation's entire addict element could lead to massive jail overcrowding and hospital emergency-room breakdown unless they are treated with the utmost love and understanding",rb,observer-sunday-bloodless-sunday,addict
267,"do not laugh at your trembling family addict and say, ''i'm glad - glad, do you hear",rb,observer-sunday-bloodless-sunday,addict
268,liverworth favor urging the addict to calm himself by spending the afternoon raking leaves,rb,observer-sunday-bloodless-sunday,addict
269,"''the most frequent complaint i hear from the wives of football addicts,'' dr",rb,observer-sunday-bloodless-sunday,addicts
270,"this was a boon to monday morning newspapers, which, always hard pressed for news, were able to fill their columns with hair-raising accounts of highway fatalities",rb,observer-sunday-bloodless-sunday,fatalities
271,"the high accident rate among sunday motorists, according to dr",rb,observer-sunday-bloodless-sunday,accident
272,"liverworth, was caused by the nervous excitement experienced by drivers when they reflected that if they weren't driving they would be at home raking leaves",rb,observer-sunday-bloodless-sunday,experienced
273,he counsels against letting your addict go sunday driving tomorrow: ''an even deadlier state of agitation may be produced in the addict behind the wheel who lapses into fantasies about football and starts to visualize a game while he is driving,rb,observer-sunday-bloodless-sunday,addict
274,"'' having seen thousands of games won in the last millisecond by a 52-yard field goal or the greatest pass reception in the history of the game, the motoring addict is apt to look through the windshield and see only the greatest pass in the history of the game being completed and, rising to punch his television set with joy, plow into the rear of a tractor-trailer",rb,observer-sunday-bloodless-sunday,addict
275,''getting to know the children'' - that's what so many addicts say they would like to do if only there weren't football,rb,observer-sunday-bloodless-sunday,addicts
276,"liverworth suggests the addict be kept in the house, confined to a room remote from the children if possible, sedated if possible",rb,observer-sunday-bloodless-sunday,addict
277,"encouraging him to take a large quantity of brandy just before bedtime saturday night can be very helpful, since brandy can produce a hangover in which nails seem to be driven into the skull, thus tending to keep the addict flat on his back and even more worried about death than an absence of football",rb,observer-sunday-bloodless-sunday,addict
278,"persons addicted to tobacco are forced to cluster in disgrace in the back of the plane, but narcotics addicts and the dozens of chemically tranquilized persons on board are given the liberty of the entire cabin",rb,observer-the-cheery-skies,addicts
279,"when the airplane door opens you will have 12 minutes to reach your connecting flight two counties to the east, but do not panic, for it will doubtless be two hours late",rb,observer-the-cheery-skies,late
280,one day an aging woman entered the room,rb,observer-things-passed,aging
281,"'' ''i thought you'd like to join the party for your grandchildren,'' said the elderly woman, introducing herself as my wife",rb,observer-things-passed,elderly
282,"i wouldn't mind koch throwing his racquet at the state legislature now and then, but i wouldn't want young people to see him doing it constantly on television",rb,observer-yet-another-tomorrow,doing it
283,"the uniform billings reflect a statewide average of the days needed for treatment and all other hospital costs, including care for the indigent",rc,the-editorial-notebook-prix-fixe-for-medicare,indigent
284,"but so far, that efficiency has not been achieved; the state's rate-setting commission has been extremely late in informing hospitals how much they may charge",rc,the-editorial-notebook-prix-fixe-for-medicare,late
285,"he did it by putting together, at least in alabama, the last great dream of martin luther king: a populist coalition of poor blacks and poor whites",rr,wallace-redux,did it
286,"by election day the liberals might have been hung over, but they were sober",rr,wallace-redux,sober
287,"he dreamed of reviving the brief, glorious coalition of poor blacks and poor whites that electrified the country during the late 19th century",rr,wallace-redux,late
288,"for as the late senator wayne morse, a master of the art and a former law school dean, used to teach his students: ''he who controls procedure, controls substance",tw,in-the-nation-a-small-c-victory,late
289,reagan's sweeping charges that the democrats are to blame for all ills; the absence on either side of sober economic analysis or plausible recommendations for a future that begins to look frightening - all have combined to make the national campaign one of the most bitter and barren in memory,tw,in-the-nation-an-ugly-campaign,sober
290,"if so, it's because of his relatively late switch to an attack on the reagan economic program - an approach mr",tw,in-the-nation-attack-on-voodoo-ii,late
291,trible now appears in danger of losing a seat the president's party had counted on adding to its slim senate majority,tw,in-the-nation-challenge-in-virginia,slim
292,"he contended, for example, that his income tax reductions ''will barely neutralize'' social security payroll tax increases",tw,in-the-nation-looking-like-jimmy,neutralize
293,that probably reflected the president's persuasive arguments for his economic program; but it also suggests a troubled belief among voters that the democrats don't have an alternative other than a return to the policies mr,tw,in-the-nation-reagan-and-1984,troubled
294,"to the extent that the so-called ''social issues'' - abortion, school prayer and the like - won him votes in 1980, four years of inability to advance these causes substantially should neutralize them in a reagan re-election campaign",tw,in-the-nation-reagan-and-1984,neutralize
295,"the fears of the elderly are a big factor here, as everywhere",tw,in-the-nation-reagan-to-the-rescue,elderly
296,"governor list, who has suffered charges of billing the state for personal expenses and exerting undue influence on gaming officials, may be making late gains in a hard race against the democratic attorney general, richard bryan",tw,in-the-nation-reagan-to-the-rescue,late
297,"preference would be given to the disadvantaged, or to those who live in areas of particularly high unemployment",tw,in-the-nation-recycling-an-idea,disadvantaged
298,"adelman so casually dismissed is in fact a 20-year, binding american commitment to achieve a comprehensive nuclear test ban",tw,in-the-nation-small-risk-for-big-gains,dismissed
299,"exit polls do not show that the democrats gained a lot of votes from elderly persons who feared a republican assault on social security - as had been inaccurately predicted by me, among others",tw,in-the-nation-the-end-of-the-affair,elderly
300,"a house subcommittee has reported that in 1977 - a typical year - 1,219 of them had to be removed from such duty because of mental disorders, 256 for alcoholism and 1,365 for drug abuse",tw,in-the-nation-war-by-accident,alcoholism
301,"even as late as 1860, sir richard burton - not today's actor but yesterday's famous explorer - while traveling by stage coach across the american plains, grumbled to his diary that the west's fabled buffalo was ''the worst and driest meat, save elk, that i have ever tasted; indeed, without the assistance of pork fat, we found it hard to swallow",tw,in-the-nation-what-the-brethren-ate,late
302,some did it well,tw,in-the-nation-what-the-brethren-ate,did it
303,"and here is a recipe - economical in language, rich in conception - for pound cake handed down from robert e",tw,in-the-nation-what-the-brethren-ate,economical
304,"we must either get out of that country, using our withdrawal as the quid pro quo for a rapprochement with the chinese, or go in with the 250,000 more troops ustinov says he needs to exterminate opposition",ws,ESSAY;-INSIDE-ANDROPOV'S-MIND-(2),exterminate
305,"the stunned audience realized that the accident was not part of the show; after waiting vainly for word of her condition, the audience somberly filed out",ws,essay-fighting-for-life,accident
306,"since this took place in washington, the talk in the opera house lobby drifted to the way that the unexpected - an accident, or a shooting - can scramble the patterns of political life",ws,essay-fighting-for-life,accident
307,"miss makarova's friend, ann getty, drew the parallel of the danger of an accident in a world of many nations armed with nuclear weapons",ws,essay-fighting-for-life,accident
308,"in response, the brezhnev-chernenko faction says no, we should keep fighting on this low level, while the grishin faction also says no, that we should send in a half million men and exterminate all resistance",ws,essay-inside-andropov-s-mind,exterminate
309,but a slim chance exists that you could make yourself the lightning rod and absorb most of the anger; mr,ws,essay-letter-to-sharon-yom-kippur-5743,slim
310,state department give judea and samaria to king hussein to pass on to the p,ws,essay-letter-to-sharon-yom-kippur-5743,pass on
311,the person with the most to lose from the success of a federal prosecutor in the westchester theater case is (a) a top corporate executive (b) an aging crooner,ws,essay-office-pool-for-1983,aging
312,now the french binge has led to a sober second thought and a huge hangover afflicts the nation,ws,essay-the-battle-of-poitiers,sober
313,"many conservatives would say that the notion of raising payroll taxes beyond the already-too-high increases built into the law contributes to inflation and unemployment, and shifts the burden of carrying the elderly too much to the gypped generation not now being consulted",ws,essay-the-gypped-generation,elderly
314,"give the elderly the most inflation protection, not the least",ws,essay-the-gypped-generation,elderly
315,", after a more experienced guide has guided the adviser toward what guidance to give",ws,essay-the-nsc-after-clark,experienced
316,richard burt has his hands full getting conservative support for his current nomination; ambassador ken adelman is a few years away; frank carlucci (like larry eagleburger) needs to make some money; and edward luttwak is too brilliant and outspoken,ws,essay-the-nsc-after-clark,outspoken
317,"workers who priced themselves and their industries out of the world market are getting laid off, and after they quit hollering for tariff protection, they'll come back to produce better products at less cost",ws,essay-the-recession-speaks,laid off
318,"then let him go to jerusalem, without preconditions, where israel's decisions will be made",ws,essay-the-ultimate-settlement,let him go
319,maybe it was a sense of betrayal that we experienced in discovering we had elected a president who was putting into practice the very things he promised as a candidate,wsc,presidential-paradoxes,experienced
